edgehog,edgehog-device-manager/edgehog,https://github.com/edgehog-device-manager/edgehog,"Easily manage your IoT device fleet with Edgehog at once. Get information on device status, deploy updates, geolocate your devices and much more!",1639,2025-01-15T13:12:47Z,512,35,False,22,Elixir,8234,1.0,False,False,False,https://api.github.com/repos/edgehog-device-manager/edgehog/contributors,https://api.github.com/repos/edgehog-device-manager/edgehog/collaborators{/collaborator},15,edge iot
Pyluos,Luos-io/Pyluos,https://github.com/Luos-io/Pyluos,A Python library to program a Luos based network through a high level interface.,616,2024-12-12T17:25:21Z,0,34,False,17,Python,486,1.0,False,False,False,https://api.github.com/repos/Luos-io/Pyluos/contributors,https://api.github.com/repos/Luos-io/Pyluos/collaborators{/collaborator},18,edge iot
JAMScript,citelab/JAMScript,https://github.com/citelab/JAMScript,A programming language for cloud of moving things (edge-based IoT),2593,2024-09-13T06:59:44Z,9,31,False,19,C,58313,1.0,False,False,False,https://api.github.com/repos/citelab/JAMScript/contributors,https://api.github.com/repos/citelab/JAMScript/collaborators{/collaborator},20,edge iot
redpanda-edge-agent,redpanda-data/redpanda-edge-agent,https://github.com/redpanda-data/redpanda-edge-agent,Lightweight internet of things agent that forwards events from the edge,59,2024-03-25T20:11:17Z,2,28,False,9,Go,7228,1.0,False,False,False,https://api.github.com/repos/redpanda-data/redpanda-edge-agent/contributors,https://api.github.com/repos/redpanda-data/redpanda-edge-agent/collaborators{/collaborator},3,edge iot
RPi-Pico-projects-for-schools,arm-university/RPi-Pico-projects-for-schools,https://github.com/arm-university/RPi-Pico-projects-for-schools,"Raspberry Pi Pico Projects for Schools:    Explore cutting-edge topics in Computing, including Machine Learning and Internet of Things. Ages 16-18. ",21,2024-07-26T08:41:42Z,1,28,False,7,Jupyter Notebook,54255,1.0,False,False,False,https://api.github.com/repos/arm-university/RPi-Pico-projects-for-schools/contributors,https://api.github.com/repos/arm-university/RPi-Pico-projects-for-schools/collaborators{/collaborator},3,edge iot
firmware-st-b-l475e-iot01a,edgeimpulse/firmware-st-b-l475e-iot01a,https://github.com/edgeimpulse/firmware-st-b-l475e-iot01a,Edge Impulse firmware for the ST B-L475E-IOT01A development board,63,2024-12-02T11:39:29Z,10,27,False,11,C,9641,1.0,False,False,False,https://api.github.com/repos/edgeimpulse/firmware-st-b-l475e-iot01a/contributors,https://api.github.com/repos/edgeimpulse/firmware-st-b-l475e-iot01a/collaborators{/collaborator},5,edge iot
FogBus2,Cloudslab/FogBus2,https://github.com/Cloudslab/FogBus2,FogBus2: A Lightweight and Distributed Container-based Framework for Integration of IoT-enabled Systems with Edge and Cloud Computing,471,2024-09-03T09:17:50Z,0,25,False,10,Python,27933,1.0,False,False,False,https://api.github.com/repos/Cloudslab/FogBus2/contributors,https://api.github.com/repos/Cloudslab/FogBus2/collaborators{/collaborator},2,edge iot
AttestationEngine,nokia/AttestationEngine,https://github.com/nokia/AttestationEngine,"An experimental (but fully functional) Remote Attestation Engine and Applications for TPM2.0 based systems (cloud, edge, IoT etc)",678,2024-01-24T10:59:41Z,25,24,False,17,Go,193873,1.0,False,False,False,https://api.github.com/repos/nokia/AttestationEngine/contributors,https://api.github.com/repos/nokia/AttestationEngine/collaborators{/collaborator},16,edge iot
magistrala,absmach/magistrala,https://github.com/absmach/magistrala,Industrial IoT Messaging and Device Management Platform,1761,2025-01-20T10:43:07Z,336,24,False,8,Go,145756,1.0,False,False,False,https://api.github.com/repos/absmach/magistrala/contributors,https://api.github.com/repos/absmach/magistrala/collaborators{/collaborator},69,edge iot
tracker-edge,particle-iot/tracker-edge,https://github.com/particle-iot/tracker-edge,Particle Tracker reference application,217,2024-12-21T01:15:04Z,25,23,False,31,C++,496,1.0,False,False,False,https://api.github.com/repos/particle-iot/tracker-edge/contributors,https://api.github.com/repos/particle-iot/tracker-edge/collaborators{/collaborator},14,edge iot
iotedge-vm-deploy,Azure/iotedge-vm-deploy,https://github.com/Azure/iotedge-vm-deploy,ARM template to deploy a VM with IoT Edge pre-installed (via cloud-init),34,2024-06-04T18:18:23Z,3,23,False,43,Bicep,63,1.0,False,False,False,https://api.github.com/repos/Azure/iotedge-vm-deploy/contributors,https://api.github.com/repos/Azure/iotedge-vm-deploy/collaborators{/collaborator},9,edge iot
noderededgemodule,iotblackbelt/noderededgemodule,https://github.com/iotblackbelt/noderededgemodule,This repo contains the documentation for Azure IoT Edge module to use node-red on IoT Edge.,94,2024-04-24T14:53:52Z,1,23,False,19,JavaScript,826,1.0,False,True,False,https://api.github.com/repos/iotblackbelt/noderededgemodule/contributors,https://api.github.com/repos/iotblackbelt/noderededgemodule/collaborators{/collaborator},2,edge iot
tempo,cifertech/tempo,https://github.com/cifertech/tempo,"an IoT Edge device equipped with ESP32, DHT22, and Ethernet W5500",7,2024-05-06T07:35:42Z,7,23,False,8,C++,534,1.0,False,False,False,https://api.github.com/repos/cifertech/tempo/contributors,https://api.github.com/repos/cifertech/tempo/collaborators{/collaborator},1,edge iot
azure-iot-edge-identity-translation-lite,Azure-Samples/azure-iot-edge-identity-translation-lite,https://github.com/Azure-Samples/azure-iot-edge-identity-translation-lite,Azure IoT Edge Identity Translation Module sample.,74,2024-04-22T07:26:46Z,1,22,False,22,C#,769,1.0,False,False,False,https://api.github.com/repos/Azure-Samples/azure-iot-edge-identity-translation-lite/contributors,https://api.github.com/repos/Azure-Samples/azure-iot-edge-identity-translation-lite/collaborators{/collaborator},12,edge iot
vuforia-spatial-edge-server,ptcrealitylab/vuforia-spatial-edge-server,https://github.com/ptcrealitylab/vuforia-spatial-edge-server,"Edge Server for the Vuforia Spatial Toolbox, a shared research platform for exploring spatial computing as a community",2723,2025-01-13T05:26:09Z,346,21,False,12,JavaScript,68532,1.0,False,False,False,https://api.github.com/repos/ptcrealitylab/vuforia-spatial-edge-server/contributors,https://api.github.com/repos/ptcrealitylab/vuforia-spatial-edge-server/collaborators{/collaborator},22,edge iot
DevEdge-IoTDevKit-ZephyrSDK,tmobile/DevEdge-IoTDevKit-ZephyrSDK,https://github.com/tmobile/DevEdge-IoTDevKit-ZephyrSDK,ZephyrSDK (TMO_shell) is a Zephyr application built by T-Mobile and comes shipped on the DevEdge - IoT Developer Kit,307,2024-05-03T20:54:48Z,0,20,False,10,C,944,1.0,False,False,False,https://api.github.com/repos/tmobile/DevEdge-IoTDevKit-ZephyrSDK/contributors,https://api.github.com/repos/tmobile/DevEdge-IoTDevKit-ZephyrSDK/collaborators{/collaborator},11,edge iot
nabto-embedded-sdk,nabto/nabto-embedded-sdk,https://github.com/nabto/nabto-embedded-sdk,"Nabto Edge Embedded SDK. Secure, direct connections to your IoT devices.",2861,2024-12-02T13:10:24Z,195,17,False,4,C,5401,1.0,False,False,False,https://api.github.com/repos/nabto/nabto-embedded-sdk/contributors,https://api.github.com/repos/nabto/nabto-embedded-sdk/collaborators{/collaborator},5,edge iot
UA-EdgeHEMS,digitaltwinconsortium/UA-EdgeHEMS,https://github.com/digitaltwinconsortium/UA-EdgeHEMS,An OPC UA server-backed Home Energy Management System (HEMS) for the Smart Home,139,2024-10-28T08:05:25Z,4,16,False,5,C#,444,1.0,False,False,False,https://api.github.com/repos/digitaltwinconsortium/UA-EdgeHEMS/contributors,https://api.github.com/repos/digitaltwinconsortium/UA-EdgeHEMS/collaborators{/collaborator},3,edge iot
A-Social-Relationship-Awareness-Based-Dependent-Task-Offloading-Algorithm-for-Mobile-Edge-Computing,charyco/A-Social-Relationship-Awareness-Based-Dependent-Task-Offloading-Algorithm-for-Mobile-Edge-Computing,https://github.com/charyco/A-Social-Relationship-Awareness-Based-Dependent-Task-Offloading-Algorithm-for-Mobile-Edge-Computing,"This study presents a task offloading algorithm that considers social relationships, task dependencies, energy consumption, and latency. It optimizes four modes—local, D2D, edge, and mixed execution—using the Hungarian algorithm. Experiments validate its effectiveness for mobile devices, IoT, data centers, and intelligent vehicles.",5,2024-07-10T11:51:12Z,5,16,False,0,Python,15,1.0,False,False,False,https://api.github.com/repos/charyco/A-Social-Relationship-Awareness-Based-Dependent-Task-Offloading-Algorithm-for-Mobile-Edge-Computing/contributors,https://api.github.com/repos/charyco/A-Social-Relationship-Awareness-Based-Dependent-Task-Offloading-Algorithm-for-Mobile-Edge-Computing/collaborators{/collaborator},1,edge iot
dotnet-template-azure-iot-edge-module,Azure/dotnet-template-azure-iot-edge-module,https://github.com/Azure/dotnet-template-azure-iot-edge-module,Scaffolding tool for Azure IoT Edge C# module,200,2024-04-30T04:43:42Z,3,15,False,23,C#,228,1.0,False,False,False,https://api.github.com/repos/Azure/dotnet-template-azure-iot-edge-module/contributors,https://api.github.com/repos/Azure/dotnet-template-azure-iot-edge-module/collaborators{/collaborator},14,edge iot
leda-distro,eclipse-leda/leda-distro,https://github.com/eclipse-leda/leda-distro,Eclipse Leda provides a Yocto-based build setup for SDV.EDGE components ,403,2024-02-18T07:13:01Z,2,15,False,7,Shell,944,1.0,False,False,False,https://api.github.com/repos/eclipse-leda/leda-distro/contributors,https://api.github.com/repos/eclipse-leda/leda-distro/collaborators{/collaborator},4,edge iot
edge-aio-in-a-box,Azure-Samples/edge-aio-in-a-box,https://github.com/Azure-Samples/edge-aio-in-a-box,Azure IoT Operations with Edge AI in-a-Box,150,2024-11-12T20:03:08Z,150,14,False,4,Jupyter Notebook,26771,1.0,False,False,False,https://api.github.com/repos/Azure-Samples/edge-aio-in-a-box/contributors,https://api.github.com/repos/Azure-Samples/edge-aio-in-a-box/collaborators{/collaborator},3,edge iot
montithings,MontiCore/montithings,https://github.com/MontiCore/montithings,An ecosystem for model-driven IoT applications,4617,2025-01-10T20:52:30Z,15,14,False,6,Java,16788,1.0,False,False,False,https://api.github.com/repos/MontiCore/montithings/contributors,https://api.github.com/repos/MontiCore/montithings/collaborators{/collaborator},34,edge iot
meta-adlink-nxp,ADLINK/meta-adlink-nxp,https://github.com/ADLINK/meta-adlink-nxp,Single Yocto layer support for all the NXP i.MX based products.,84,2025-01-17T12:57:29Z,7,14,False,16,,53419,1.0,False,False,False,https://api.github.com/repos/ADLINK/meta-adlink-nxp/contributors,https://api.github.com/repos/ADLINK/meta-adlink-nxp/collaborators{/collaborator},5,edge iot
eden,eml-eda/eden,https://github.com/eml-eda/eden,Efficient Decision tree Ensembles libary for IoT edge nodes,37,2024-10-02T10:44:27Z,11,13,False,0,Python,326,1.0,False,False,False,https://api.github.com/repos/eml-eda/eden/contributors,https://api.github.com/repos/eml-eda/eden/collaborators{/collaborator},1,edge iot
iot-gateway,industrial-edge/iot-gateway,https://github.com/industrial-edge/iot-gateway,Using the IE system apps to preprocess PLC data and push it to the cloud,41,2024-12-18T11:31:31Z,16,12,False,7,,23704,1.0,False,False,False,https://api.github.com/repos/industrial-edge/iot-gateway/contributors,https://api.github.com/repos/industrial-edge/iot-gateway/collaborators{/collaborator},10,edge iot
edgehog-device-runtime,edgehog-device-manager/edgehog-device-runtime,https://github.com/edgehog-device-manager/edgehog-device-runtime,"Edgehog Device Runtime is a portable middleware written in Rust, that enables remote device management on Linux-based systems.",676,2025-01-20T09:04:12Z,338,12,False,12,Rust,1493,1.0,False,False,False,https://api.github.com/repos/edgehog-device-manager/edgehog-device-runtime/contributors,https://api.github.com/repos/edgehog-device-manager/edgehog-device-runtime/collaborators{/collaborator},11,edge iot
saf,TRUMPF-IoT/saf,https://github.com/TRUMPF-IoT/saf,Smart Application Framework (SAF) is a .NET based framework for building distributed applications across cloud and edge.,375,2025-01-07T16:33:21Z,21,12,False,1,C#,1122,1.0,False,False,False,https://api.github.com/repos/TRUMPF-IoT/saf/contributors,https://api.github.com/repos/TRUMPF-IoT/saf/collaborators{/collaborator},5,edge iot
talk-to-your-factory,chriscrcodes/talk-to-your-factory,https://github.com/chriscrcodes/talk-to-your-factory,"'Talk to Your Factory' demo leveraging Edge (Azure IoT Operations), Cloud (Microsoft Fabric), and a Factory Agent (Azure OpenAI), to streamline factory operations. It allows real-time, natural language communication with factory systems, helping operators quickly identify issues, boost efficiency, and minimize downtime.",138,2024-12-20T16:05:50Z,138,11,False,4,Python,26465,1.0,False,False,False,https://api.github.com/repos/chriscrcodes/talk-to-your-factory/contributors,https://api.github.com/repos/chriscrcodes/talk-to-your-factory/collaborators{/collaborator},1,edge iot
