AI-Girlfriend-Desktop-Pet,DD-MASTERT/AI-Girlfriend-Desktop-Pet,https://github.com/DD-MASTERT/AI-Girlfriend-Desktop-Pet,AIæ¡Œå® 2.2ï¼ˆç½‘é¡µç«¯toklenç™½å«–å›½äº§å¤§æ¨¡å‹æœåŠ¡å™¨ï¼ˆglm4ï¼Œkimiï¼Œdeepseekv2ï¼‰ï¼Œè¯­éŸ³è¯†åˆ«ï¼Œå±å¹•è¯†åˆ«è‡ªåŠ¨å‘é€ï¼Œlive2d 2.0å’Œ3.0æ¨¡å‹ï¼Œgpt-sovitsè¯­éŸ³ï¼Œcoysvoiceè¯­éŸ³ï¼Œedge-ttsè¯­éŸ³ï¼ˆæ”¯æŒå¤šè¯­è¨€éŸ³è‰²ï¼‰ï¼Œæœ¬åœ°ollamaæ¨¡å‹æ— é™åˆ¶èŠå¤©ï¼‰ï¼ˆä¸»æµå›½äº§å¤§æ¨¡å‹apiæ¥å£æ”¯æŒï¼‰,35,2024-08-17T18:53:32Z,35,98,False,20,Python,9985,1.0,False,False,False,https://api.github.com/repos/DD-MASTERT/AI-Girlfriend-Desktop-Pet/contributors,https://api.github.com/repos/DD-MASTERT/AI-Girlfriend-Desktop-Pet/collaborators{/collaborator},1,edge ai
ai8x-training,analogdevicesinc/ai8x-training,https://github.com/analogdevicesinc/ai8x-training,Model Training for ADI's MAX78000 and MAX78002 Edge AI Devices,243,2025-01-14T00:04:03Z,45,95,False,91,Jupyter Notebook,231469,1.0,False,False,False,https://api.github.com/repos/analogdevicesinc/ai8x-training/contributors,https://api.github.com/repos/analogdevicesinc/ai8x-training/collaborators{/collaborator},13,edge ai
cosdata,cosdata/cosdata,https://github.com/cosdata/cosdata,"Cosdata: A cutting-edge AI data platform for next-gen search pipelines. Features semantic search, knowledge graphs, hybrid capabilities, real-time scalability, and ML integration. Designed for immutability and version control to enhance AI projects. ",596,2025-01-19T15:24:50Z,554,95,False,23,Rust,2041,1.0,False,False,False,https://api.github.com/repos/cosdata/cosdata/contributors,https://api.github.com/repos/cosdata/cosdata/collaborators{/collaborator},15,edge ai
quanta-quest,quanta-quest/quanta-quest,https://github.com/quanta-quest/quanta-quest,"AI-powered universal search for all your personal data, tailored just for you.  Goal:The world's first product with ""edge-side LLMs + consumer data localization"" as its core development direction. ",4,2024-10-15T11:12:15Z,4,95,False,5,TypeScript,2722,1.0,False,False,False,https://api.github.com/repos/quanta-quest/quanta-quest/contributors,https://api.github.com/repos/quanta-quest/quanta-quest/collaborators{/collaborator},1,edge ai
AutoRLAIF,xuyang-sudo/AutoRLAIF,https://github.com/xuyang-sudo/AutoRLAIF,AutoRLAIF  is a cutting-edge framework designed to revolutionize the fine-tuning of large language models through Reinforcement Learning from AI Feedback (RLAIF).,25,2024-10-27T01:03:17Z,25,92,False,9,Python,607,1.0,False,False,False,https://api.github.com/repos/xuyang-sudo/AutoRLAIF/contributors,https://api.github.com/repos/xuyang-sudo/AutoRLAIF/collaborators{/collaborator},1,edge ai
ai-anime-art-generator,enterwiz/ai-anime-art-generator,https://github.com/enterwiz/ai-anime-art-generator,"AI-driven cutting-edge tool for anime arts creation, perfect for beginners to easily create stunning anime art without any prior experience.",15,2024-08-10T02:35:08Z,15,90,False,39,TypeScript,252,1.0,False,False,False,https://api.github.com/repos/enterwiz/ai-anime-art-generator/contributors,https://api.github.com/repos/enterwiz/ai-anime-art-generator/collaborators{/collaborator},1,edge ai
AI-on-the-edge-device-docs,jomjol/AI-on-the-edge-device-docs,https://github.com/jomjol/AI-on-the-edge-device-docs,Github for hosting the documentation for the project: https://github.com/jomjol/AI-on-the-edge-device,401,2025-01-19T01:44:43Z,75,84,False,40,Python,106847,1.0,False,False,False,https://api.github.com/repos/jomjol/AI-on-the-edge-device-docs/contributors,https://api.github.com/repos/jomjol/AI-on-the-edge-device-docs/collaborators{/collaborator},23,edge ai
akeru,AkeruAI/akeru,https://github.com/AkeruAI/akeru,"Akeru is an open source AI platform built on top of the Akeru AI edge network. The network runs as a Bittensor Subnet, providing a transparent, safe and highly available AI capacities.",219,2024-06-23T19:47:24Z,205,84,False,17,TypeScript,16908,1.0,False,True,False,https://api.github.com/repos/AkeruAI/akeru/contributors,https://api.github.com/repos/AkeruAI/akeru/collaborators{/collaborator},9,edge ai
airbitz-core,EdgeApp/airbitz-core,https://github.com/EdgeApp/airbitz-core,"Bitcoin wallet C/C++ API for building cross-platform applications that require user authentication, encryption, backup, and meta-data management. This library alone implements the full functionality of the Airbitz Edge Security platform and bitcoin wallet minus the graphical interface. ",1944,2024-03-25T17:58:50Z,0,82,False,43,C++,4132,1.0,False,False,False,https://api.github.com/repos/EdgeApp/airbitz-core/contributors,https://api.github.com/repos/EdgeApp/airbitz-core/collaborators{/collaborator},10,edge ai
omniscient,RicardoGEsteves/omniscient,https://github.com/RicardoGEsteves/omniscient,"Cutting-edge Full-stack AI Platform delivered as a SaaS (Software as a Service). Built on a robust technology stack, integrated with powerful APIs such as OpenAI and Replicate, offers a seamless experience for code generation, conversation simulation, image creation, music composition, and video generation.",297,2025-01-19T16:07:22Z,209,82,False,19,TypeScript,3539,1.0,False,False,False,https://api.github.com/repos/RicardoGEsteves/omniscient/contributors,https://api.github.com/repos/RicardoGEsteves/omniscient/collaborators{/collaborator},3,edge ai
KAN,Azure/KAN,https://github.com/Azure/KAN,"KubeAI Application Nucleus for edge is a solution accelerator for creating, deploying, and operating environment-aware solutions at scale that use artificial intelligence (AI) at the edge with the control and flexibility of open-source natively on your environment. ",165,2024-05-15T08:00:06Z,80,77,False,22,TypeScript,67854,1.0,False,False,False,https://api.github.com/repos/Azure/KAN/contributors,https://api.github.com/repos/Azure/KAN/collaborators{/collaborator},8,edge ai
edge-slm,deepsense-ai/edge-slm,https://github.com/deepsense-ai/edge-slm,This project is a native implementation of a RAG pipeline for Small Language Models tested on Android devices. The main goal was to fit the whole RAG pipeline into a resource constrained device - ie. smartphone. By design the provided RAG library should be deployable on various platforms.,3,2024-04-12T09:15:09Z,3,72,False,4,C++,4086,1.0,False,False,False,https://api.github.com/repos/deepsense-ai/edge-slm/contributors,https://api.github.com/repos/deepsense-ai/edge-slm/collaborators{/collaborator},1,edge ai
duix.ai,akan/duix.ai,https://github.com/akan/duix.ai,offline 2d digitalhuman demo for edge devices (android/ios/etc.),19,2024-04-30T06:01:02Z,19,70,False,55,,124628,1.0,False,False,False,https://api.github.com/repos/akan/duix.ai/contributors,https://api.github.com/repos/akan/duix.ai/collaborators{/collaborator},1,edge ai
Phi-3MiniSamples,Azure-Samples/Phi-3MiniSamples,https://github.com/Azure-Samples/Phi-3MiniSamples,"Discover how phi3-mini, a new series of models from Microsoft, enables deployment of Large Language Models (LLMs) on edge devices and IoT devices. Learn how to use Semantic Kernel, Ollama/LlamaEdge, and ONNX Runtime to access and infer phi3-mini models, and explore the possibilities of generative AI in various application scenarios",34,2024-07-09T19:46:18Z,34,70,False,18,C++,6414,1.0,False,False,False,https://api.github.com/repos/Azure-Samples/Phi-3MiniSamples/contributors,https://api.github.com/repos/Azure-Samples/Phi-3MiniSamples/collaborators{/collaborator},5,edge ai
AirLine,sair-lab/AirLine,https://github.com/sair-lab/AirLine,AirLine: Efficient Learnable Line Detection with Local Edge Voting (IROS 2023),63,2024-07-30T21:45:45Z,8,69,False,3,Python,224378,1.0,False,False,False,https://api.github.com/repos/sair-lab/AirLine/contributors,https://api.github.com/repos/sair-lab/AirLine/collaborators{/collaborator},2,edge ai
cgra4ml,KastnerRG/cgra4ml,https://github.com/KastnerRG/cgra4ml,An Open Workflow to Build Custom SoCs and run Deep Models at the Edge,1138,2024-11-22T19:46:08Z,129,69,False,10,SystemVerilog,13041,1.0,False,False,False,https://api.github.com/repos/KastnerRG/cgra4ml/contributors,https://api.github.com/repos/KastnerRG/cgra4ml/collaborators{/collaborator},7,edge ai
edge2ai-workshop,asdaraujo/edge2ai-workshop,https://github.com/asdaraujo/edge2ai-workshop,Edge2AI Workshop,582,2025-01-14T07:45:37Z,89,68,False,101,Python,98504,1.0,False,False,False,https://api.github.com/repos/asdaraujo/edge2ai-workshop/contributors,https://api.github.com/repos/asdaraujo/edge2ai-workshop/collaborators{/collaborator},7,edge ai
node-red-contrib-ml,Seeed-Studio/node-red-contrib-ml,https://github.com/Seeed-Studio/node-red-contrib-ml,Get started with AI vision at the edge with no coding experience at all!,23,2025-01-08T09:13:52Z,1,68,False,31,JavaScript,5574,1.0,False,False,False,https://api.github.com/repos/Seeed-Studio/node-red-contrib-ml/contributors,https://api.github.com/repos/Seeed-Studio/node-red-contrib-ml/collaborators{/collaborator},5,edge ai
edgerunner,neuralize-ai/edgerunner,https://github.com/neuralize-ai/edgerunner,Simplified AI runtime integration for mobile app development,355,2024-11-29T13:52:56Z,355,65,False,4,C++,34787,1.0,False,False,False,https://api.github.com/repos/neuralize-ai/edgerunner/contributors,https://api.github.com/repos/neuralize-ai/edgerunner/collaborators{/collaborator},1,edge ai
Awesome-EdgeAI,wangxb96/Awesome-EdgeAI,https://github.com/wangxb96/Awesome-EdgeAI,"Resources of our survey paper ""Optimizing Edge AI: A Comprehensive Survey on Data, Model, and System Strategies""",125,2025-01-08T10:12:56Z,7,63,False,7,,3813,1.0,False,False,False,https://api.github.com/repos/wangxb96/Awesome-EdgeAI/contributors,https://api.github.com/repos/wangxb96/Awesome-EdgeAI/collaborators{/collaborator},1,edge ai
Top-10-AI-Projects,Mouneshgouda/Top-10-AI-Projects,https://github.com/Mouneshgouda/Top-10-AI-Projects,"This repository curates a collection of the top 10 artificial intelligence projects from various domains. From cutting-edge research to practical applications, these projects showcase the latest advancements in AI technology.",19,2024-03-15T10:12:48Z,18,60,False,47,Jupyter Notebook,12836,1.0,False,False,False,https://api.github.com/repos/Mouneshgouda/Top-10-AI-Projects/contributors,https://api.github.com/repos/Mouneshgouda/Top-10-AI-Projects/collaborators{/collaborator},1,edge ai
ai8x-synthesis,analogdevicesinc/ai8x-synthesis,https://github.com/analogdevicesinc/ai8x-synthesis,Quantization and Synthesis (Device Specific Code Generation) for ADI's MAX78000 and MAX78002 Edge AI Devices,305,2024-12-06T14:24:53Z,35,59,False,60,Python,677035,1.0,False,False,False,https://api.github.com/repos/analogdevicesinc/ai8x-synthesis/contributors,https://api.github.com/repos/analogdevicesinc/ai8x-synthesis/collaborators{/collaborator},14,edge ai
litert-samples,google-ai-edge/litert-samples,https://github.com/google-ai-edge/litert-samples,,209,2025-01-07T20:20:25Z,207,59,False,17,,9531,1.0,False,False,False,https://api.github.com/repos/google-ai-edge/litert-samples/contributors,https://api.github.com/repos/google-ai-edge/litert-samples/collaborators{/collaborator},7,edge ai
GroqApiLibrary,jgravelle/GroqApiLibrary,https://github.com/jgravelle/GroqApiLibrary,"This powerful and flexible library provides a seamless interface to interact with the cutting-edge Groq AI API. Designed for .NET 8 and above, our library offers a range of features to enhance your AI-powered applications.",41,2025-01-18T00:47:35Z,39,57,False,14,C#,122,1.0,False,False,False,https://api.github.com/repos/jgravelle/GroqApiLibrary/contributors,https://api.github.com/repos/jgravelle/GroqApiLibrary/collaborators{/collaborator},2,edge ai
agentic-voice,ruvnet/agentic-voice,https://github.com/ruvnet/agentic-voice,"Agentic Chat App is an advanced AI-powered chat application designed for seamless real-time communication and intelligent responses. Built with Next.js, OpenAI, and Exa API, it leverages cutting-edge technologies to enhance user interactions and provide contextual, relevant information dynamically.",20,2024-07-15T15:26:01Z,20,57,False,20,TypeScript,6623,1.0,False,False,False,https://api.github.com/repos/ruvnet/agentic-voice/contributors,https://api.github.com/repos/ruvnet/agentic-voice/collaborators{/collaborator},1,edge ai
TabMark-Bookmark-New-Tab,Alanrk/TabMark-Bookmark-New-Tab,https://github.com/Alanrk/TabMark-Bookmark-New-Tab,TabMarkæ˜¯ä¸€æ¬¾åŸºäºä¹¦ç­¾çš„æ–°æ ‡ç­¾é¡µæ’ä»¶ï¼Œå°†ä½ çš„æ”¶è—å¤¹å˜æˆæ–°æ ‡ç­¾é¡µï¼Œè®©ä½ æ”¶è—çš„ä¹¦ç­¾ä¸€ç›®äº†ç„¶ã€æ•´æ´é«˜æ•ˆï¼Œå¿«é€Ÿç›´è¾¾ä½ æœ€éœ€è¦çš„ç½‘ç«™å’Œèµ„æºã€‚æ­é…æ™ºèƒ½ AI æœç´¢ï¼Œæ›´å¿«æ‰¾åˆ°ä½ æƒ³è¦çš„ç­”æ¡ˆã€‚æ”¯æŒ Chrome å’Œ Edgeã€‚,9,2025-01-15T06:42:43Z,7,57,False,6,JavaScript,6744,1.0,False,False,False,https://api.github.com/repos/Alanrk/TabMark-Bookmark-New-Tab/contributors,https://api.github.com/repos/Alanrk/TabMark-Bookmark-New-Tab/collaborators{/collaborator},1,edge ai
Ernie-AI-Windows,Azerty01-bit/Ernie-AI-Windows,https://github.com/Azerty01-bit/Ernie-AI-Windows,"Ernie-AI-Windows is an innovative artificial intelligence software tailored specifically for Windows operating systems, delivering cutting-edge AI capabilities for enhanced user experience and productivity. Through advanced algorithms and intuitive interfaces, Ernie-AI-Windows streamlines tasks and offers personalized recommendations to optimize wo",1,2024-04-05T15:23:33Z,1,54,False,8,,1,1.0,False,False,False,https://api.github.com/repos/Azerty01-bit/Ernie-AI-Windows/contributors,https://api.github.com/repos/Azerty01-bit/Ernie-AI-Windows/collaborators{/collaborator},1,edge ai
piccolo,sensiml/piccolo,https://github.com/sensiml/piccolo,SensiML's open-source AutoML solution for Edge AI model development,77,2025-01-17T01:48:25Z,54,53,False,7,Python,96464,1.0,False,False,False,https://api.github.com/repos/sensiml/piccolo/contributors,https://api.github.com/repos/sensiml/piccolo/collaborators{/collaborator},5,edge ai
amazon-sagemaker-edge-defect-detection-computer-vision,aws-samples/amazon-sagemaker-edge-defect-detection-computer-vision,https://github.com/aws-samples/amazon-sagemaker-edge-defect-detection-computer-vision,Workshop showcasing how to run defect detection using computer vision at the edge with Amazon SageMaker,50,2024-11-04T19:16:10Z,7,50,False,20,Python,2777,1.0,False,False,False,https://api.github.com/repos/aws-samples/amazon-sagemaker-edge-defect-detection-computer-vision/contributors,https://api.github.com/repos/aws-samples/amazon-sagemaker-edge-defect-detection-computer-vision/collaborators{/collaborator},4,edge ai
Seeed_Studio_Courses,Seeed-Studio/Seeed_Studio_Courses,https://github.com/Seeed-Studio/Seeed_Studio_Courses,Edge AI 101 Course using Nvidia Jetson,9,2025-01-14T02:59:26Z,5,49,False,19,C++,57473,1.0,False,False,False,https://api.github.com/repos/Seeed-Studio/Seeed_Studio_Courses/contributors,https://api.github.com/repos/Seeed-Studio/Seeed_Studio_Courses/collaborators{/collaborator},4,edge ai
tokay-lite-sdk,maxlab-io/tokay-lite-sdk,https://github.com/maxlab-io/tokay-lite-sdk,Tokay Lite: Low Power Edge AI Camera SDK,117,2024-09-29T11:43:21Z,6,49,False,7,C++,829,1.0,False,False,False,https://api.github.com/repos/maxlab-io/tokay-lite-sdk/contributors,https://api.github.com/repos/maxlab-io/tokay-lite-sdk/collaborators{/collaborator},2,edge ai
aitour-exploring-cutting-edge-models,microsoft/aitour-exploring-cutting-edge-models,https://github.com/microsoft/aitour-exploring-cutting-edge-models,,201,2024-12-16T05:36:09Z,201,45,False,15,C++,56660,1.0,False,False,False,https://api.github.com/repos/microsoft/aitour-exploring-cutting-edge-models/contributors,https://api.github.com/repos/microsoft/aitour-exploring-cutting-edge-models/collaborators{/collaborator},7,edge ai
segger_dev,EliHei2/segger_dev,https://github.com/EliHei2/segger_dev,"a cutting-edge cell segmentation model specifically designed for single-molecule resolved spatial omics datasets. It addresses the challenge of accurately segmenting individual cells in complex imaging datasets, leveraging a unique approach based on graph neural networks (GNNs).",375,2025-01-13T10:40:16Z,354,44,False,4,Python,5018,1.0,False,False,False,https://api.github.com/repos/EliHei2/segger_dev/contributors,https://api.github.com/repos/EliHei2/segger_dev/collaborators{/collaborator},7,edge ai
The-AiEdge-Code-Examples,damienbenveniste/The-AiEdge-Code-Examples,https://github.com/damienbenveniste/The-AiEdge-Code-Examples,,19,2024-11-15T19:19:28Z,19,40,False,15,Jupyter Notebook,2014,1.0,False,False,False,https://api.github.com/repos/damienbenveniste/The-AiEdge-Code-Examples/contributors,https://api.github.com/repos/damienbenveniste/The-AiEdge-Code-Examples/collaborators{/collaborator},1,edge ai
hf-daily-paper-newsletter-chinese,2404589803/hf-daily-paper-newsletter-chinese,https://github.com/2404589803/hf-daily-paper-newsletter-chinese,"ğŸ”¥Your Daily Dose of AI Research from Hugging Face ğŸ”¥  Stay updated with the latest AI breakthroughs! This bot automatically collects and analyzes papers from ğŸ¤— Hugging Face's daily papers, providing Chinese translations and AI-powered interpretations. Powered by state-of-the-art language models, it brings cutting-edge research to your finger",713,2025-01-19T14:21:52Z,629,40,False,3,HTML,186375,1.0,False,False,False,https://api.github.com/repos/2404589803/hf-daily-paper-newsletter-chinese/contributors,https://api.github.com/repos/2404589803/hf-daily-paper-newsletter-chinese/collaborators{/collaborator},3,edge ai
Nectar-GPT,socialtribexyz/Nectar-GPT,https://github.com/socialtribexyz/Nectar-GPT,"NectarGPT is a cutting-edge open-source Chrome extension powered by GPT-X. Automate tasks like coding, writing product descriptions, creating social media posts effortlessly and more. Experience AI-driven productivity and enhanced user experience.",48,2024-06-03T17:35:54Z,5,40,False,3,,2552,1.0,False,False,False,https://api.github.com/repos/socialtribexyz/Nectar-GPT/contributors,https://api.github.com/repos/socialtribexyz/Nectar-GPT/collaborators{/collaborator},1,edge ai
edgedb-ai-booking-assistant,beerose/edgedb-ai-booking-assistant,https://github.com/beerose/edgedb-ai-booking-assistant,AI Booking Assistant with EdgeDB and Vercel AI SDK,42,2024-03-28T13:32:44Z,42,39,False,4,TypeScript,179,1.0,False,False,False,https://api.github.com/repos/beerose/edgedb-ai-booking-assistant/contributors,https://api.github.com/repos/beerose/edgedb-ai-booking-assistant/collaborators{/collaborator},2,edge ai
AiVoiceClonerPRO,AryanVBW/AiVoiceClonerPRO,https://github.com/AryanVBW/AiVoiceClonerPRO,"Revolutionize Your Voice with AI Voice Cloner! Transform Your Speech into Your Favorite Celebrity's or Your Customized Voice. Our Cutting-edge Tool Converts Text or Any Audio into Your Desired Voice â€“ Your Voice, Your Way",714,2025-01-08T20:37:47Z,3,39,False,7,Python,13492,1.0,False,False,False,https://api.github.com/repos/AryanVBW/AiVoiceClonerPRO/contributors,https://api.github.com/repos/AryanVBW/AiVoiceClonerPRO/collaborators{/collaborator},93,edge ai
PowerToys4OpenAI,robert-hoffmann/PowerToys4OpenAI,https://github.com/robert-hoffmann/PowerToys4OpenAI,"GPT chat extension for Chrome, Edge, and Opera. Direct integration with search results. Full chat interface with history management. No server needed & cost effective.",111,2024-08-21T13:09:41Z,3,39,False,7,Vue,550,1.0,False,False,False,https://api.github.com/repos/robert-hoffmann/PowerToys4OpenAI/contributors,https://api.github.com/repos/robert-hoffmann/PowerToys4OpenAI/collaborators{/collaborator},2,edge ai
edge-infer,unit-mesh/edge-infer,https://github.com/unit-mesh/edge-infer,"EdgeInfer enables efficient edge intelligence by running small AI models, including embeddings and OnnxModels, on resource-constrained devices like Android, iOS, or MCUs for real-time decision-making. EdgeInfer æ—¨åœ¨èµ„æºå—é™çš„è®¾å¤‡ä¸Šè¿è¡Œå°å‹ AI æ¨¡å‹ï¼ˆåŒ…æ‹¬å‘é‡åŒ–å’Œ Onnx æ¨¡å‹ï¼‰ï¼Œå¦‚ Androidã€iOS æˆ– MCUsï¼Œå®ç°é«˜æ•ˆçš„è¾¹ç¼˜æ™ºèƒ½ï¼Œç”¨äºå®æ—¶å†³ç­–ã€‚",121,2024-04-17T09:23:00Z,11,39,False,2,Rust,280,1.0,False,False,False,https://api.github.com/repos/unit-mesh/edge-infer/contributors,https://api.github.com/repos/unit-mesh/edge-infer/collaborators{/collaborator},3,edge ai
edgeai-tensorlab,TexasInstruments/edgeai-tensorlab,https://github.com/TexasInstruments/edgeai-tensorlab,Edge AI Model Development Tools,29744,2024-10-22T10:13:41Z,2443,37,False,8,Python,637634,1.0,False,False,False,https://api.github.com/repos/TexasInstruments/edgeai-tensorlab/contributors,https://api.github.com/repos/TexasInstruments/edgeai-tensorlab/collaborators{/collaborator},100,edge ai
AISonobuoy,IQTLabs/AISonobuoy,https://github.com/IQTLabs/AISonobuoy,Maritime Situational Awareness: An Exploration,2425,2025-01-18T01:55:07Z,0,37,False,21,C,88583,1.0,False,False,False,https://api.github.com/repos/IQTLabs/AISonobuoy/contributors,https://api.github.com/repos/IQTLabs/AISonobuoy/collaborators{/collaborator},18,edge ai
cloudflare-for-speed-and-security,skerkour/cloudflare-for-speed-and-security,https://github.com/skerkour/cloudflare-for-speed-and-security,Scale faster and save big with the global edge cloud platform - https://kerkour.com/cloudflare-for-speed-and-security,98,2024-03-05T18:10:02Z,0,36,False,7,TypeScript,1371,1.0,False,False,False,https://api.github.com/repos/skerkour/cloudflare-for-speed-and-security/contributors,https://api.github.com/repos/skerkour/cloudflare-for-speed-and-security/collaborators{/collaborator},0,edge ai
xsai,moeru-ai/xsai,https://github.com/moeru-ai/xsai,"ğŸ¤–ğŸ’¬ extra-small AI SDK for Browser, Node.js, Deno, Bun or Edge Runtime.",246,2025-01-19T06:18:19Z,208,34,False,4,TypeScript,554,1.0,False,False,False,https://api.github.com/repos/moeru-ai/xsai/contributors,https://api.github.com/repos/moeru-ai/xsai/collaborators{/collaborator},4,edge ai
terraform-provider-hsdp,philips-software/terraform-provider-hsdp,https://github.com/philips-software/terraform-provider-hsdp,"Terraform provider to orchestrate various HSDP resources like IAM, CDL, CDR, MDM, Container Host, Edge, etc",1967,2025-01-17T11:12:50Z,132,34,False,14,Go,50863,1.0,False,False,False,https://api.github.com/repos/philips-software/terraform-provider-hsdp/contributors,https://api.github.com/repos/philips-software/terraform-provider-hsdp/collaborators{/collaborator},11,edge ai
EdgeAISIM,MuhammedGolec/EdgeAISIM,https://github.com/MuhammedGolec/EdgeAISIM,[MS 24] EdgeAISim: A Toolkit for Simulation and Modelling of AI Models in Edge Computing Environments,20,2024-02-13T17:26:54Z,4,32,False,11,Python,94,1.0,False,False,False,https://api.github.com/repos/MuhammedGolec/EdgeAISIM/contributors,https://api.github.com/repos/MuhammedGolec/EdgeAISIM/collaborators{/collaborator},3,edge ai
Finance_AgenticAI,shivamim/Finance_AgenticAI,https://github.com/shivamim/Finance_AgenticAI,"Financial Agentic AI redefines financial analysis by integrating cutting-edge AI with real-time web search capabilities. This multi-agent system brings together financial insights and web intelligence to deliver precise, actionable, and up-to-date stock market information, all tailored to your needs.",17,2024-12-28T20:08:54Z,17,31,False,15,Python,46,1.0,False,False,False,https://api.github.com/repos/shivamim/Finance_AgenticAI/contributors,https://api.github.com/repos/shivamim/Finance_AgenticAI/collaborators{/collaborator},1,edge ai
qllm,quantalogic/qllm,https://github.com/quantalogic/qllm,"QLLM: A powerful CLI for seamless interaction with multiple Large Language Models. Simplify AI workflows, streamline development, and unlock the potential of cutting-edge language models.  â­ If you find QLLM useful, consider giving us a star on GitHub! It helps us reach more developers and improve the tool. â­",428,2025-01-07T22:32:23Z,427,31,False,5,TypeScript,2524,1.0,False,False,False,https://api.github.com/repos/quantalogic/qllm/contributors,https://api.github.com/repos/quantalogic/qllm/collaborators{/collaborator},4,edge ai
TEG-Benchmark,Zhuofeng-Li/TEG-Benchmark,https://github.com/Zhuofeng-Li/TEG-Benchmark,[NeurIPS 2024 ğŸ”¥] TEG-DB: A Comprehensive Dataset and Benchmark of Textual-Edge Graphs,29,2025-01-15T02:32:13Z,28,31,False,2,Python,1033,1.0,False,False,False,https://api.github.com/repos/Zhuofeng-Li/TEG-Benchmark/contributors,https://api.github.com/repos/Zhuofeng-Li/TEG-Benchmark/collaborators{/collaborator},1,edge ai
EdgeAI-Toolkit,AIDrive-Research/EdgeAI-Toolkit,https://github.com/AIDrive-Research/EdgeAI-Toolkit,ğŸ”¥ğŸ”¥æœºå™¨è§†è§‰è¾¹ç¼˜è®¡ç®—çš„æˆç†Ÿåº”ç”¨ï¼Œé€‚é…RKç‘èŠ¯å¾®/Ascendæ˜‡è…¾ç³»åˆ—èŠ¯ç‰‡ï¼Œæä¾›æ¨¡å‹è®­ç»ƒã€æ¨¡å‹é‡åŒ–æºä»£ç ğŸ”¥ğŸ”¥,63,2025-01-16T09:17:11Z,25,30,False,9,Python,408389,1.0,False,False,False,https://api.github.com/repos/AIDrive-Research/EdgeAI-Toolkit/contributors,https://api.github.com/repos/AIDrive-Research/EdgeAI-Toolkit/collaborators{/collaborator},3,edge ai
edgerunner-android,neuralize-ai/edgerunner-android,https://github.com/neuralize-ai/edgerunner-android,Kotlin bindings for Edgerunner,71,2024-07-17T23:52:48Z,71,30,False,0,Kotlin,10231,1.0,False,False,False,https://api.github.com/repos/neuralize-ai/edgerunner-android/contributors,https://api.github.com/repos/neuralize-ai/edgerunner-android/collaborators{/collaborator},1,edge ai
