name,full_name,URL,desc.,total_commits,last_commit,commits_2024,stars,fork,forks,lang,size,score,template,archived,disabled,contributors_url,collaborators_url,collaborators,search_term
mediapipe,google-ai-edge/mediapipe,https://github.com/google-ai-edge/mediapipe,"Cross-platform, customizable ML solutions for live and streaming media.",4406,2025-01-17T18:25:05Z,1395,28296,False,5221,C++,603480,1.0,False,False,False,https://api.github.com/repos/google-ai-edge/mediapipe/contributors,https://api.github.com/repos/google-ai-edge/mediapipe/collaborators{/collaborator},79,edge ai
semantic-kernel,microsoft/semantic-kernel,https://github.com/microsoft/semantic-kernel,Integrate cutting-edge LLM technology quickly and easily into your apps,3885,2025-01-18T07:21:06Z,1697,22714,False,3421,C#,65687,1.0,False,False,False,https://api.github.com/repos/microsoft/semantic-kernel/contributors,https://api.github.com/repos/microsoft/semantic-kernel/collaborators{/collaborator},100,edge ai
BingGPT,dice2o/BingGPT,https://github.com/dice2o/BingGPT,"Desktop application of new Bing's AI-powered chat (Windows, macOS and Linux)",46,2024-02-08T15:06:01Z,0,9224,False,710,JavaScript,1657,1.0,False,False,False,https://api.github.com/repos/dice2o/BingGPT/contributors,https://api.github.com/repos/dice2o/BingGPT/collaborators{/collaborator},2,edge ai
AI-on-the-edge-device,jomjol/AI-on-the-edge-device,https://github.com/jomjol/AI-on-the-edge-device,"Easy to use device for connecting ""old"" measuring units (water, power, gas, ...) to the digital world",2026,2025-01-17T22:16:56Z,266,6266,False,677,C++,163077,1.0,False,False,False,https://api.github.com/repos/jomjol/AI-on-the-edge-device/contributors,https://api.github.com/repos/jomjol/AI-on-the-edge-device/collaborators{/collaborator},61,edge ai
mindspore,mindspore-ai/mindspore,https://github.com/mindspore-ai/mindspore,"MindSpore is a new open source deep learning training/inference framework that could be used for mobile, edge and cloud scenarios.",83896,2024-07-29T01:48:05Z,7097,4372,False,718,C++,869597,1.0,False,False,False,https://api.github.com/repos/mindspore-ai/mindspore/contributors,https://api.github.com/repos/mindspore-ai/mindspore/collaborators{/collaborator},93,edge ai
VILA,NVlabs/VILA,https://github.com/NVlabs/VILA,"VILA is a family of state-of-the-art vision language models (VLMs) for diverse multimodal AI tasks across the edge, data center, and cloud.",76,2025-01-11T08:40:08Z,59,2788,False,223,Python,71722,1.0,False,False,False,https://api.github.com/repos/NVlabs/VILA/contributors,https://api.github.com/repos/NVlabs/VILA/collaborators{/collaborator},15,edge ai
Java-Interview-Tutorial,Java-Edge/Java-Interview-Tutorial,https://github.com/Java-Edge/Java-Interview-Tutorial,è¯·starï¼Œå‹¿forkï¼Œå› ä¸ºçˆ±force pushï¼æ¶µç›–å›½é™…å¤§å‚Java/æ•°æ®åº“/DDD/è®¾è®¡æ¨¡å¼/å¾®æœåŠ¡/ä¸­é—´ä»¶/AIå¤§æ¨¡å‹åº”ç”¨/åŒºå—é“¾å¼€å‘æœ€ä½³å®è·µã€‚å…³æ³¨å…¬ä¼—å·ã€JavaEdgeã€‘ï¼Œä¸€èµ·äº¤æµå­¦ä¹ ï¼,214,2024-12-15T15:08:46Z,209,2716,False,480,Shell,58306,1.0,False,False,False,https://api.github.com/repos/Java-Edge/Java-Interview-Tutorial/contributors,https://api.github.com/repos/Java-Edge/Java-Interview-Tutorial/collaborators{/collaborator},4,edge ai
executorch,pytorch/executorch,https://github.com/pytorch/executorch,"On-device AI across mobile, embedded and edge for PyTorch",5271,2025-01-19T11:35:00Z,3856,2412,False,420,C++,150581,1.0,False,False,False,https://api.github.com/repos/pytorch/executorch/contributors,https://api.github.com/repos/pytorch/executorch/collaborators{/collaborator},100,edge ai
inngest,inngest/inngest,https://github.com/inngest/inngest,"The leading workflow orchestration platform.  Run stateful step functions and AI workflows on serverless, servers, or the edge.",4174,2025-01-17T23:31:55Z,1097,2356,False,91,Go,325678,1.0,False,False,False,https://api.github.com/repos/inngest/inngest/contributors,https://api.github.com/repos/inngest/inngest/collaborators{/collaborator},24,edge ai
mediapipe-samples,google-ai-edge/mediapipe-samples,https://github.com/google-ai-edge/mediapipe-samples,,698,2025-01-07T23:10:42Z,128,1755,False,452,Jupyter Notebook,138977,1.0,False,False,False,https://api.github.com/repos/google-ai-edge/mediapipe-samples/contributors,https://api.github.com/repos/google-ai-edge/mediapipe-samples/collaborators{/collaborator},43,edge ai
yomo,yomorun/yomo,https://github.com/yomorun/yomo,"ğŸ¦– Stateful Serverless Framework for Geo-distributed Edge AI Infra. with function calling support, write once, run on any model.",602,2025-01-19T03:38:40Z,141,1694,False,129,Go,68921,1.0,False,False,False,https://api.github.com/repos/yomorun/yomo/contributors,https://api.github.com/repos/yomorun/yomo/collaborators{/collaborator},18,edge ai
MaixPy-v1,sipeed/MaixPy-v1,https://github.com/sipeed/MaixPy-v1,"MicroPython for K210 RISC-V, let's play with edge AI easier",598,2024-06-17T07:52:31Z,4,1688,False,441,Python,57173,1.0,False,False,False,https://api.github.com/repos/sipeed/MaixPy-v1/contributors,https://api.github.com/repos/sipeed/MaixPy-v1/collaborators{/collaborator},28,edge ai
Vitis-AI,Xilinx/Vitis-AI,https://github.com/Xilinx/Vitis-AI,"Vitis AI is Xilinxâ€™s development stack for AI inference on Xilinx hardware platforms, including both edge devices and Alveo cards.",1253,2024-09-12T07:20:12Z,3,1526,False,640,Python,2361712,1.0,False,False,False,https://api.github.com/repos/Xilinx/Vitis-AI/contributors,https://api.github.com/repos/Xilinx/Vitis-AI/collaborators{/collaborator},34,edge ai
model-explorer,google-ai-edge/model-explorer,https://github.com/google-ai-edge/model-explorer,A modern model graph visualizer and debugger,293,2025-01-16T19:41:29Z,285,1103,False,92,JavaScript,80827,1.0,False,False,False,https://api.github.com/repos/google-ai-edge/model-explorer/contributors,https://api.github.com/repos/google-ai-edge/model-explorer/collaborators{/collaborator},21,edge ai
SydneyQt,juzeon/SydneyQt,https://github.com/juzeon/SydneyQt,A cross-platform desktop client for the jailbroken New Bing AI Copilot (Sydney ver.) built with Go and Wails (previously based on Python and Qt).,424,2024-11-22T06:45:49Z,185,873,False,80,Go,13042,1.0,False,False,False,https://api.github.com/repos/juzeon/SydneyQt/contributors,https://api.github.com/repos/juzeon/SydneyQt/collaborators{/collaborator},3,edge ai
ktransformers,kvcache-ai/ktransformers,https://github.com/kvcache-ai/ktransformers,A Flexible Framework for Experiencing Cutting-edge LLM Inference Optimizations,98,2024-11-14T12:07:13Z,98,833,False,47,Python,6580,1.0,False,False,False,https://api.github.com/repos/kvcache-ai/ktransformers/contributors,https://api.github.com/repos/kvcache-ai/ktransformers/collaborators{/collaborator},16,edge ai
Magick,Oneirocom/Magick,https://github.com/Oneirocom/Magick,Magick is a cutting-edge toolkit for a new kind of AI builder. Make Magick with us!,9551,2024-11-27T23:51:03Z,3817,753,False,124,TypeScript,110747,1.0,False,False,False,https://api.github.com/repos/Oneirocom/Magick/contributors,https://api.github.com/repos/Oneirocom/Magick/collaborators{/collaborator},37,edge ai
MouseTooltipTranslator,ttop32/MouseTooltipTranslator,https://github.com/ttop32/MouseTooltipTranslator,"Mouseover Translate Any Language At Once - Chrome Extension: PDF Translator, EBOOK, EPUB, OCR, TTS, YOUTUBE DUAL SUBTITLES, GOOGLE DOCS, AI, VIEWER, GMAIL, WRITING, IMAGE, DUAL SUBS, MANGA, HOVER, DICTIONARY, WEBTOON, EDGE, JAPANESE, ENGLISH",1048,2025-01-12T01:59:56Z,674,745,False,114,JavaScript,289211,1.0,False,False,False,https://api.github.com/repos/ttop32/MouseTooltipTranslator/contributors,https://api.github.com/repos/ttop32/MouseTooltipTranslator/collaborators{/collaborator},11,edge ai
DeepStack,johnolafenwa/DeepStack,https://github.com/johnolafenwa/DeepStack,The World's Leading Cross Platform AI Engine for Edge Devices,282,2024-06-13T15:03:35Z,0,723,False,114,Python,413887,1.0,False,False,False,https://api.github.com/repos/johnolafenwa/DeepStack/contributors,https://api.github.com/repos/johnolafenwa/DeepStack/collaborators{/collaborator},5,edge ai
model_server,openvinotoolkit/model_server,https://github.com/openvinotoolkit/model_server,A scalable inference server for models optimized with OpenVINOâ„¢,2689,2025-01-19T23:16:54Z,484,697,False,213,C++,54087,1.0,False,False,False,https://api.github.com/repos/openvinotoolkit/model_server/contributors,https://api.github.com/repos/openvinotoolkit/model_server/collaborators{/collaborator},42,edge ai
audio-recorder-polyfill,ai/audio-recorder-polyfill,https://github.com/ai/audio-recorder-polyfill,MediaRecorder polyfill to record audio in Edge and Safari,239,2024-09-21T09:30:02Z,8,589,False,76,JavaScript,2418,1.0,False,True,False,https://api.github.com/repos/ai/audio-recorder-polyfill/contributors,https://api.github.com/repos/ai/audio-recorder-polyfill/collaborators{/collaborator},15,edge ai
noScribe,kaixxx/noScribe,https://github.com/kaixxx/noScribe,Cutting edge AI technology for automated audio transcription. A nice GUI for OpenAIs Whisper and pyannote (speaker identification),370,2025-01-19T11:31:39Z,83,578,False,120,Python,279790,1.0,False,False,False,https://api.github.com/repos/kaixxx/noScribe/contributors,https://api.github.com/repos/kaixxx/noScribe/collaborators{/collaborator},8,edge ai
ai-edge-torch,google-ai-edge/ai-edge-torch,https://github.com/google-ai-edge/ai-edge-torch,Supporting PyTorch models with the Google AI Edge TFLite runtime.,311,2025-01-17T22:17:37Z,290,427,False,54,Jupyter Notebook,11396,1.0,False,False,False,https://api.github.com/repos/google-ai-edge/ai-edge-torch/contributors,https://api.github.com/repos/google-ai-edge/ai-edge-torch/collaborators{/collaborator},24,edge ai
edge-ai,crespum/edge-ai,https://github.com/crespum/edge-ai,A curated list of resources for embedded AI,57,2025-01-15T08:10:34Z,9,383,False,47,,82,1.0,False,False,False,https://api.github.com/repos/crespum/edge-ai/contributors,https://api.github.com/repos/crespum/edge-ai/collaborators{/collaborator},6,edge ai
EdgeChains,arakoodev/EdgeChains,https://github.com/arakoodev/EdgeChains,"EdgeChains.js is Full-Stack GenAI library. Front-end, backend, apis, prompt management, distributed computing. All core prompts & chains are managed declaratively in jsonnet (and not hidden in classes)",467,2025-01-01T02:28:35Z,224,376,False,78,JavaScript,45784,1.0,False,False,False,https://api.github.com/repos/arakoodev/EdgeChains/contributors,https://api.github.com/repos/arakoodev/EdgeChains/collaborators{/collaborator},20,edge ai
hal-9100,llm-edge/hal-9100,https://github.com/llm-edge/hal-9100,Edge full-stack LLM platform. Written in Rust,433,2024-05-25T09:42:43Z,200,374,False,31,Rust,1661,1.0,False,False,False,https://api.github.com/repos/llm-edge/hal-9100/contributors,https://api.github.com/repos/llm-edge/hal-9100/collaborators{/collaborator},6,edge ai
openai-edge-tts,travisvn/openai-edge-tts,https://github.com/travisvn/openai-edge-tts,"Free, high-quality text-to-speech API endpoint to replace OpenAI, Azure, or ElevenLabs",35,2024-12-28T23:01:19Z,35,366,False,52,Python,139,1.0,False,False,False,https://api.github.com/repos/travisvn/openai-edge-tts/contributors,https://api.github.com/repos/travisvn/openai-edge-tts/collaborators{/collaborator},1,edge ai
askaitools-community-edition,askaitools/askaitools-community-edition,https://github.com/askaitools/askaitools-community-edition,A cutting-edge search engine project tailored specifically for the AI product,2,2024-07-11T13:03:36Z,2,345,False,29,TypeScript,760,1.0,False,False,False,https://api.github.com/repos/askaitools/askaitools-community-edition/contributors,https://api.github.com/repos/askaitools/askaitools-community-edition/collaborators{/collaborator},1,edge ai
edgen,edgenai/edgen,https://github.com/edgenai/edgen,"âš¡  Edgen: Local, private GenAI server alternative to OpenAI. No GPU required. Run AI models locally: LLMs (Llama2, Mistral, Mixtral...), Speech-to-text (whisper) and many others.",315,2024-05-23T14:21:38Z,315,344,False,16,Rust,2481,1.0,False,False,False,https://api.github.com/repos/edgenai/edgen/contributors,https://api.github.com/repos/edgenai/edgen/collaborators{/collaborator},7,edge ai
vscode-tools-for-ai,microsoft/vscode-tools-for-ai,https://github.com/microsoft/vscode-tools-for-ai,"Azure Machine Learning for Visual Studio Code, previously called Visual Studio Code Tools for AI, is an extension to easily build, train, and deploy machine learning models to the cloud or the edge with Azure Machine Learning service.",147,2025-01-08T00:17:13Z,6,327,False,96,Python,177734,1.0,False,False,False,https://api.github.com/repos/microsoft/vscode-tools-for-ai/contributors,https://api.github.com/repos/microsoft/vscode-tools-for-ai/collaborators{/collaborator},22,edge ai
RealtimeSTT_LLM_TTS,Ikaros-521/RealtimeSTT_LLM_TTS,https://github.com/Ikaros-521/RealtimeSTT_LLM_TTS,å®æ—¶STTï¼Œè¿æ¥OpenAIæ¥å£/æ™ºè°±AIï¼ˆæµå¼LLMï¼‰å’ŒGPT-SOVITS/Edge-TTSï¼Œé€šè¿‡ç½‘é¡µçš„æ–¹å¼ï¼Œè¿›è¡Œè·¨ç½‘ç»œçš„æœåŠ¡è°ƒç”¨ï¼Œå®ç°å®æ—¶å¯¹è¯çš„æ•ˆæœ,20,2024-12-31T09:30:03Z,20,297,False,42,Python,324,1.0,False,False,False,https://api.github.com/repos/Ikaros-521/RealtimeSTT_LLM_TTS/contributors,https://api.github.com/repos/Ikaros-521/RealtimeSTT_LLM_TTS/collaborators{/collaborator},1,edge ai
motion-ai,dcmartin/motion-ai,https://github.com/dcmartin/motion-ai,AI assisted motion detection for Home Assistant,10151,2024-02-08T17:43:31Z,3,296,False,29,Jupyter Notebook,361169,1.0,False,False,False,https://api.github.com/repos/dcmartin/motion-ai/contributors,https://api.github.com/repos/dcmartin/motion-ai/collaborators{/collaborator},4,edge ai
denser-retriever,denser-org/denser-retriever,https://github.com/denser-org/denser-retriever,"An enterprise-grade AI retriever designed to streamline AI integration into your applications, ensuring cutting-edge accuracy.",52,2025-01-19T19:53:06Z,52,279,False,37,Python,4159,1.0,False,False,False,https://api.github.com/repos/denser-org/denser-retriever/contributors,https://api.github.com/repos/denser-org/denser-retriever/collaborators{/collaborator},4,edge ai
Whatsapp-Ai-BOT,yesbhautik/Whatsapp-Ai-BOT,https://github.com/yesbhautik/Whatsapp-Ai-BOT,"Introducing the AI Chatbot for WhatsApp - a cutting-edge solution powered by OpenAI's ChatGPT, Playground & DALLÂ·E. This innovative chatbot has been developed using NodeJS technology and leverages the latest advancements in AI to provide an unmatched user experience for WhatsApp today!",112,2024-07-12T03:09:04Z,26,268,False,237,JavaScript,18801,1.0,False,False,False,https://api.github.com/repos/yesbhautik/Whatsapp-Ai-BOT/contributors,https://api.github.com/repos/yesbhautik/Whatsapp-Ai-BOT/collaborators{/collaborator},6,edge ai
leapfrogai,defenseunicorns/leapfrogai,https://github.com/defenseunicorns/leapfrogai,"Production-ready Generative AI for local, cloud native, airgap, and edge deployments.",734,2024-11-13T16:06:55Z,350,265,False,29,Python,19351,1.0,False,False,False,https://api.github.com/repos/defenseunicorns/leapfrogai/contributors,https://api.github.com/repos/defenseunicorns/leapfrogai/collaborators{/collaborator},30,edge ai
Whisper-TikTok,MatteoFasulo/Whisper-TikTok,https://github.com/MatteoFasulo/Whisper-TikTok,"From AI tools to TikTok video creation using FFMPEG, Microsoft Edge read aloud and OpenAI Whisper model",130,2025-01-06T20:58:47Z,47,251,False,44,Python,28225,1.0,False,False,False,https://api.github.com/repos/MatteoFasulo/Whisper-TikTok/contributors,https://api.github.com/repos/MatteoFasulo/Whisper-TikTok/collaborators{/collaborator},7,edge ai
autogen-agi,SageMindAI/autogen-agi,https://github.com/SageMindAI/autogen-agi,"AutoGen AGI: Advancing AI agents using AutoGen towards AGI capabilities. Explore cutting-edge enhancements in group chat dynamics, decision-making, and complex task proficiency. Join our journey in shaping AI's future!",75,2024-02-15T22:03:10Z,1,249,False,43,Python,464,1.0,False,False,False,https://api.github.com/repos/SageMindAI/autogen-agi/contributors,https://api.github.com/repos/SageMindAI/autogen-agi/collaborators{/collaborator},1,edge ai
ztachip,ztachip/ztachip,https://github.com/ztachip/ztachip,Opensource software/hardware platform to build edge AI solutions deployed on FPGA or custom ASIC hardware.,413,2024-08-21T03:06:22Z,63,239,False,34,C++,173338,1.0,False,False,False,https://api.github.com/repos/ztachip/ztachip/contributors,https://api.github.com/repos/ztachip/ztachip/collaborators{/collaborator},2,edge ai
LiteRT,google-ai-edge/LiteRT,https://github.com/google-ai-edge/LiteRT,"LiteRT is the new name for TensorFlow Lite (TFLite). While the name is new, it's still the same trusted, high-performance runtime for on-device AI, now with an expanded vision.",261,2025-01-19T21:01:14Z,175,237,False,20,C++,49963,1.0,False,False,False,https://api.github.com/repos/google-ai-edge/LiteRT/contributors,https://api.github.com/repos/google-ai-edge/LiteRT/collaborators{/collaborator},32,edge ai
MaixPy,sipeed/MaixPy,https://github.com/sipeed/MaixPy,Easily create AI projects with Python on edge device,443,2025-01-17T10:44:06Z,408,225,False,47,Python,63546,1.0,False,False,False,https://api.github.com/repos/sipeed/MaixPy/contributors,https://api.github.com/repos/sipeed/MaixPy/collaborators{/collaborator},13,edge ai
edge,cartesia-ai/edge,https://github.com/cartesia-ai/edge,On-device intelligence.,2,2024-09-11T19:42:10Z,2,217,False,13,Python,4267,1.0,False,False,False,https://api.github.com/repos/cartesia-ai/edge/contributors,https://api.github.com/repos/cartesia-ai/edge/collaborators{/collaborator},2,edge ai
choco-builder,unit-mesh/choco-builder,https://github.com/unit-mesh/choco-builder,ChocoBuilder (Chocolate Factory) is a cutting-edge LLM toolkit designed to empower you in creating your very own AI assistant.Chocolate Factory æ˜¯ä¸€æ¬¾å¼€æºçš„ LLM åº”ç”¨å¼€å‘æ¡†æ¶ï¼Œæ—¨åœ¨å¸®åŠ©æ‚¨è½»æ¾æ‰“é€ å¼ºå¤§çš„è½¯ä»¶å¼€å‘ SDLC + LLM ç”ŸæˆåŠ©æ‰‹ã€‚æ— è®ºæ‚¨æ˜¯éœ€è¦ç”Ÿæˆå‰ç«¯é¡µé¢ã€åç«¯ APIã€SQL å›¾è¡¨ï¼Œè¿˜æ˜¯æµ‹è¯•ç”¨ä¾‹æ•°æ®ï¼ŒChocolate Factory éƒ½èƒ½æ»¡è¶³æ‚¨çš„éœ€æ±‚ã€‚,1000,2024-07-24T01:45:29Z,49,205,False,18,Kotlin,25344,1.0,False,False,False,https://api.github.com/repos/unit-mesh/choco-builder/contributors,https://api.github.com/repos/unit-mesh/choco-builder/collaborators{/collaborator},3,edge ai
fin-sight,vishwasg217/fin-sight,https://github.com/vishwasg217/fin-sight,"FinSight - Financial Insights at Your Fingertip: FinSight is a cutting-edge AI assistant tailored for portfolio managers, investors, and finance enthusiasts. It streamlines the process of gaining crucial insights and summaries about a company in a user-friendly manner.",119,2024-07-10T10:46:51Z,4,203,False,76,Jupyter Notebook,26875,1.0,False,False,False,https://api.github.com/repos/vishwasg217/fin-sight/contributors,https://api.github.com/repos/vishwasg217/fin-sight/collaborators{/collaborator},2,edge ai
aXeleRate,AIWintermuteAI/aXeleRate,https://github.com/AIWintermuteAI/aXeleRate,Keras-based framework for AI on the Edge,265,2024-03-05T09:24:49Z,3,180,False,71,Python,9870,1.0,False,False,False,https://api.github.com/repos/AIWintermuteAI/aXeleRate/contributors,https://api.github.com/repos/AIWintermuteAI/aXeleRate/collaborators{/collaborator},5,edge ai
ReEdgeGPT,Integration-Automation/ReEdgeGPT,https://github.com/Integration-Automation/ReEdgeGPT,Microsoft's Bing Chat AI,306,2024-12-18T10:04:54Z,150,166,False,30,Python,3132,1.0,False,True,False,https://api.github.com/repos/Integration-Automation/ReEdgeGPT/contributors,https://api.github.com/repos/Integration-Automation/ReEdgeGPT/collaborators{/collaborator},5,edge ai
agent-hub,DjangoPeng/agent-hub,https://github.com/DjangoPeng/agent-hub,"This repository is a hub for AI Agent projects, including GitHub Sentinel, LanguageMentor, and ChatPPT, designed to enhance enterprise workflows, language learning, and multimodal interaction. Explore a growing family of agents geared towards revolutionizing various industries with cutting-edge AI solutions.",25,2024-11-03T09:02:02Z,25,152,False,114,Shell,43,1.0,False,False,False,https://api.github.com/repos/DjangoPeng/agent-hub/contributors,https://api.github.com/repos/DjangoPeng/agent-hub/collaborators{/collaborator},1,edge ai
aiexe,kstost/aiexe,https://github.com/kstost/aiexe,"aiexe, the cutting-edge command-line interface (CLI/GUI) tool",119,2024-07-25T07:56:13Z,119,145,False,53,JavaScript,755,1.0,False,False,False,https://api.github.com/repos/kstost/aiexe/contributors,https://api.github.com/repos/kstost/aiexe/collaborators{/collaborator},2,edge ai
swan,turingmotors/swan,https://github.com/turingmotors/swan,"This project aims to enable language model inference on FPGAs, supporting AI applications in edge devices and environments with limited resources.",4,2024-04-27T06:57:16Z,4,140,False,3,C++,2440,1.0,False,False,False,https://api.github.com/repos/turingmotors/swan/contributors,https://api.github.com/repos/turingmotors/swan/collaborators{/collaborator},2,edge ai
edgeai-tidl-tools,TexasInstruments/edgeai-tidl-tools,https://github.com/TexasInstruments/edgeai-tidl-tools,Edgeai TIDL Tools and Examples - This repository contains Tools and example developed for Deep learning runtime (DLRT) offering provided by TIâ€™s edge AI solutions. ,545,2024-12-20T10:43:48Z,158,139,False,34,Python,18878,1.0,False,False,False,https://api.github.com/repos/TexasInstruments/edgeai-tidl-tools/contributors,https://api.github.com/repos/TexasInstruments/edgeai-tidl-tools/collaborators{/collaborator},12,edge ai
toolmate,eliranwong/toolmate,https://github.com/eliranwong/toolmate,"ToolMate AI, developed by Eliran Wong, is a cutting-edge AI companion that seamlessly integrates agents, tools, and plugins to excel in conversations, generative work, and task execution. Supports custom workflow and plugins to automate multi-step actions.",333,2025-01-11T18:52:19Z,322,137,False,14,Python,41668,1.0,False,False,False,https://api.github.com/repos/eliranwong/toolmate/contributors,https://api.github.com/repos/eliranwong/toolmate/collaborators{/collaborator},2,edge ai
edgeai,TexasInstruments/edgeai,https://github.com/TexasInstruments/edgeai,Edge AI Software and Development Tools,53,2024-10-21T09:36:31Z,13,135,False,13,Shell,1554,1.0,False,False,False,https://api.github.com/repos/TexasInstruments/edgeai/contributors,https://api.github.com/repos/TexasInstruments/edgeai/collaborators{/collaborator},1,edge ai
Whatsapp_Instagram_Messanger_ChatGPT_OpenAI,JoseHenriqueSiqueira/Whatsapp_Instagram_Messanger_ChatGPT_OpenAI,https://github.com/JoseHenriqueSiqueira/Whatsapp_Instagram_Messanger_ChatGPT_OpenAI,"This repository showcases a ChatBot integrated with WhatsApp, using OpenAI API (such as ChatGPT). With it, you can interact with a highly trained language model to answer your questions and perform specific tasks quickly and efficiently. Don't miss the opportunity to experience cutting-edge AI technology directly on your WhatsApp.",17,2024-02-13T23:23:55Z,0,135,False,43,Python,180,1.0,False,False,False,https://api.github.com/repos/JoseHenriqueSiqueira/Whatsapp_Instagram_Messanger_ChatGPT_OpenAI/contributors,https://api.github.com/repos/JoseHenriqueSiqueira/Whatsapp_Instagram_Messanger_ChatGPT_OpenAI/collaborators{/collaborator},1,edge ai
shady.ai,BrutalCoding/shady.ai,https://github.com/BrutalCoding/shady.ai,Making offline AI models accessible to all types of edge devices.,55,2024-02-12T21:28:29Z,0,134,False,14,Dart,106367,1.0,False,False,False,https://api.github.com/repos/BrutalCoding/shady.ai/contributors,https://api.github.com/repos/BrutalCoding/shady.ai/collaborators{/collaborator},3,edge ai
holoscan-sdk,nvidia-holoscan/holoscan-sdk,https://github.com/nvidia-holoscan/holoscan-sdk,The AI sensor processing SDK for low latency streaming workflows,25,2025-01-10T05:24:47Z,11,124,False,32,C++,35639,1.0,False,False,False,https://api.github.com/repos/nvidia-holoscan/holoscan-sdk/contributors,https://api.github.com/repos/nvidia-holoscan/holoscan-sdk/collaborators{/collaborator},6,edge ai
bleedingedge.ai,bleedingedgeai/bleedingedge.ai,https://github.com/bleedingedgeai/bleedingedge.ai,Bleeding edge is a feed of noteworthy developments in AI and machine learning.,290,2024-01-26T18:41:04Z,1,123,False,13,TypeScript,3962,1.0,False,False,False,https://api.github.com/repos/bleedingedgeai/bleedingedge.ai/contributors,https://api.github.com/repos/bleedingedgeai/bleedingedge.ai/collaborators{/collaborator},2,edge ai
MaximAI_Documentation,analogdevicesinc/MaximAI_Documentation,https://github.com/analogdevicesinc/MaximAI_Documentation,START HERE: Documentation for ADI's MAX78000 and MAX78002 Edge AI devices,111,2024-05-13T16:18:32Z,5,101,False,44,,276610,1.0,False,False,False,https://api.github.com/repos/analogdevicesinc/MaximAI_Documentation/contributors,https://api.github.com/repos/analogdevicesinc/MaximAI_Documentation/collaborators{/collaborator},13,edge ai
